{
  "_metadata": {
    "version": "Placeholder - pending 123rd Edition",
    "effective_date": "2026-07-01",
    "placeholder": true,
    "source": {
      "document": "CRA T4127 Payroll Deductions Formulas",
      "edition": "122nd Edition (January 2026) - PLACEHOLDER",
      "table": "Table 8.1",
      "url": "https://www.canada.ca/en/revenue-agency/services/forms-publications/payroll/t4127-payroll-deductions-formulas.html",
      "accessed_date": "2025-12-26",
      "notes": "This is placeholder data copied from January 2026 edition. Update when CRA releases July 2026 (123rd Edition)."
    },
    "validation": {
      "pdoc_validated": false,
      "pdoc_validation_date": null,
      "test_cases_passed": 0,
      "notes": "Placeholder data - awaiting 123rd Edition release"
    },
    "changes_from_previous": [],
    "last_updated": "2025-12-30",
    "updated_by": "claude-code"
  },
  "year": 2026,
  "effective_date": "2026-07-01",
  "source": "CRA T4127 (122nd Edition, January 2026) - Table 8.1 [PLACEHOLDER - awaiting 123rd Edition]",
  "bpaf": 16452.00,
  "cea": 1501.00,
  "indexing_rate": 0.020,
  "brackets": [
    {
      "threshold": 0,
      "rate": 0.14,
      "constant": 0,
      "description": "14% on first $58,523"
    },
    {
      "threshold": 58523,
      "rate": 0.205,
      "constant": 3804,
      "description": "20.5% on $58,523 to $117,045"
    },
    {
      "threshold": 117045,
      "rate": 0.26,
      "constant": 10241,
      "description": "26% on $117,045 to $181,440"
    },
    {
      "threshold": 181440,
      "rate": 0.29,
      "constant": 15685,
      "description": "29% on $181,440 to $258,482"
    },
    {
      "threshold": 258482,
      "rate": 0.33,
      "constant": 26024,
      "description": "33% on over $258,482"
    }
  ],
  "k1_rate": 0.14,
  "k2_cpp_ei_rate": 0.14,
  "k4_canada_employment_rate": 0.14
}
